{
  "schema_version": "career-market-learning-dossier-v1",
  "evidence_mode": "synthetic",
  "locale": "es",
  "as_of_date": "2026-08-13",
  "state": "complete",
  "source_research_snapshot": "snap-market-sha256-0000000000000000000000000000000000000000000000000000000000000000",
  "source_executive_dossier_snapshot": "snap-dossier-sha256-0000000000000000000000000000000000000000000000000000000000000000",
  "search_summary": {"vacancy_sample_count": 5, "bounded_queries_run": 12, "limit_reason": "target_reached", "limitation": "none"},
  "vacancy_cards": [
    {"vacancy_id": "V-001", "employer_name": "Fixture Employer A", "title": "Reliability Engineer", "location": "Mexico", "arrangement": "hybrid", "source_kind": "official_employer", "source_url": "https://example.com/careers/v-001", "requirements": [{"requirement_id": "V-001-R-01", "signal": "alpha", "importance": "must_have"}], "earned_points": 0, "maximum_points": 4, "known_points": 0, "alignment_percent": 0, "evidence_coverage_percent": 0, "interpretation": "directional_documented_evidence_not_hiring_fit", "qualitative_band": "insufficient_evidence"},
    {"vacancy_id": "V-002", "employer_name": "Fixture Employer B", "title": "Platform Engineer", "location": "Mexico", "arrangement": "remote", "source_kind": "official_employer", "source_url": "https://example.com/careers/v-002", "requirements": [{"requirement_id": "V-002-R-01", "signal": "bravo", "importance": "must_have"}], "earned_points": 0, "maximum_points": 4, "known_points": 0, "alignment_percent": 0, "evidence_coverage_percent": 0, "interpretation": "directional_documented_evidence_not_hiring_fit", "qualitative_band": "insufficient_evidence"},
    {"vacancy_id": "V-003", "employer_name": "Fixture Employer C", "title": "DevOps Engineer", "location": "Mexico", "arrangement": "hybrid", "source_kind": "official_employer", "source_url": "https://example.com/careers/v-003", "requirements": [{"requirement_id": "V-003-R-01", "signal": "charlie", "importance": "must_have"}], "earned_points": 0, "maximum_points": 4, "known_points": 0, "alignment_percent": 0, "evidence_coverage_percent": 0, "interpretation": "directional_documented_evidence_not_hiring_fit", "qualitative_band": "insufficient_evidence"},
    {"vacancy_id": "V-004", "employer_name": "Fixture Employer D", "title": "Cloud Engineer", "location": "Mexico", "arrangement": "flexible", "source_kind": "official_employer", "source_url": "https://example.com/careers/v-004", "requirements": [{"requirement_id": "V-004-R-01", "signal": "delta", "importance": "must_have"}], "earned_points": 0, "maximum_points": 4, "known_points": 0, "alignment_percent": 0, "evidence_coverage_percent": 0, "interpretation": "directional_documented_evidence_not_hiring_fit", "qualitative_band": "insufficient_evidence"},
    {"vacancy_id": "V-005", "employer_name": "Fixture Employer E", "title": "Site Engineer", "location": "Mexico", "arrangement": "onsite", "source_kind": "official_employer", "source_url": "https://example.com/careers/v-005", "requirements": [{"requirement_id": "V-005-R-01", "signal": "echo", "importance": "must_have"}], "earned_points": 0, "maximum_points": 4, "known_points": 0, "alignment_percent": 0, "evidence_coverage_percent": 0, "interpretation": "directional_documented_evidence_not_hiring_fit", "qualitative_band": "insufficient_evidence"}
  ],
  "matrix_rows": [
    {"signal": "alpha", "support_state": "unknown", "evidence_ids": [], "cells": [{"vacancy_id": "V-001", "required": true}, {"vacancy_id": "V-002", "required": false}, {"vacancy_id": "V-003", "required": false}, {"vacancy_id": "V-004", "required": false}, {"vacancy_id": "V-005", "required": false}]},
    {"signal": "bravo", "support_state": "unknown", "evidence_ids": [], "cells": [{"vacancy_id": "V-001", "required": false}, {"vacancy_id": "V-002", "required": true}, {"vacancy_id": "V-003", "required": false}, {"vacancy_id": "V-004", "required": false}, {"vacancy_id": "V-005", "required": false}]},
    {"signal": "charlie", "support_state": "unknown", "evidence_ids": [], "cells": [{"vacancy_id": "V-001", "required": false}, {"vacancy_id": "V-002", "required": false}, {"vacancy_id": "V-003", "required": true}, {"vacancy_id": "V-004", "required": false}, {"vacancy_id": "V-005", "required": false}]},
    {"signal": "delta", "support_state": "unknown", "evidence_ids": [], "cells": [{"vacancy_id": "V-001", "required": false}, {"vacancy_id": "V-002", "required": false}, {"vacancy_id": "V-003", "required": false}, {"vacancy_id": "V-004", "required": true}, {"vacancy_id": "V-005", "required": false}]},
    {"signal": "echo", "support_state": "unknown", "evidence_ids": [], "cells": [{"vacancy_id": "V-001", "required": false}, {"vacancy_id": "V-002", "required": false}, {"vacancy_id": "V-003", "required": false}, {"vacancy_id": "V-004", "required": false}, {"vacancy_id": "V-005", "required": true}]}
  ],
  "recurrence_rows": [
    {"signal": "alpha", "occurrences": 1, "sample_size": 5, "display_fraction": "1/5", "support_state": "unknown", "evidence_ids": []},
    {"signal": "bravo", "occurrences": 1, "sample_size": 5, "display_fraction": "1/5", "support_state": "unknown", "evidence_ids": []},
    {"signal": "charlie", "occurrences": 1, "sample_size": 5, "display_fraction": "1/5", "support_state": "unknown", "evidence_ids": []},
    {"signal": "delta", "occurrences": 1, "sample_size": 5, "display_fraction": "1/5", "support_state": "unknown", "evidence_ids": []},
    {"signal": "echo", "occurrences": 1, "sample_size": 5, "display_fraction": "1/5", "support_state": "unknown", "evidence_ids": []}
  ],
  "learning_state": "not_evaluated", "learning_decisions": [], "methodology_boundary": "sample_based_documented_evidence_only_no_hiring_fit", "privacy_boundary": "identity_free_evidence_references_only", "no_external_action": true
}
